{
  "$schema": "https://json-schema.org/draft/2020-12/schema",
  "$id": "https://example.com/codeagents-x1/docs/data/agents-metadata.schema.json",
  "title": "agents-metadata",
  "type": "object",
  "additionalProperties": false,
  "required": [
    "schema_version",
    "last_updated",
    "agents"
  ],
  "properties": {
    "schema_version": {
      "type": "integer",
      "minimum": 1
    },
    "last_updated": {
      "type": "string",
      "pattern": "^\\d{4}-\\d{2}-\\d{2}$"
    },
    "maintainer_note": {
      "type": "string"
    },
    "agents": {
      "type": "array",
      "minItems": 1,
      "items": {
        "$ref": "#/$defs/agent"
      }
    }
  },
  "$defs": {
    "downloads": {
      "type": "object",
      "additionalProperties": false,
      "required": [
        "type",
        "value",
        "as_of"
      ],
      "properties": {
        "type": {
          "type": "string",
          "enum": [
            "npm_weekly",
            "pypi_monthly",
            "none",
            "unknown"
          ]
        },
        "value": {
          "type": "string",
          "minLength": 1
        },
        "as_of": {
          "type": "string",
          "pattern": "^\\d{4}-\\d{2}-\\d{2}$"
        }
      }
    },
    "evidence": {
      "type": "object",
      "additionalProperties": false,
      "required": [
        "status",
        "source_type",
        "evidence_path",
        "last_verified"
      ],
      "properties": {
        "status": {
          "type": "string",
          "enum": [
            "complete",
            "partial",
            "single-file-only"
          ]
        },
        "source_type": {
          "type": "string",
          "enum": [
            "source-analysis",
            "binary-analysis",
            "summary-analysis",
            "official-docs"
          ]
        },
        "evidence_path": {
          "type": "string",
          "minLength": 1
        },
        "last_verified": {
          "type": "string",
          "pattern": "^\\d{4}-\\d{2}-\\d{2}$"
        }
      }
    },
    "agent": {
      "type": "object",
      "additionalProperties": false,
      "required": [
        "id",
        "name",
        "category",
        "license",
        "developer",
        "implementation_language",
        "runtime",
        "package_ecosystem",
        "evidence"
      ],
      "properties": {
        "id": {
          "type": "string",
          "pattern": "^[a-z0-9]+(?:-[a-z0-9]+)*$"
        },
        "name": {
          "type": "string",
          "minLength": 1
        },
        "category": {
          "type": "string",
          "enum": [
            "deep-analysis",
            "single-file"
          ]
        },
        "license": {
          "type": "string",
          "minLength": 1
        },
        "developer": {
          "type": "string",
          "minLength": 1
        },
        "implementation_language": {
          "type": "string",
          "minLength": 1
        },
        "runtime": {
          "type": "string",
          "minLength": 1
        },
        "package_ecosystem": {
          "type": "string",
          "minLength": 1
        },
        "stars": {
          "type": "string"
        },
        "downloads": {
          "$ref": "#/$defs/downloads"
        },
        "pricing_summary": {
          "type": "string"
        },
        "free_tier": {
          "type": "string"
        },
        "evidence": {
          "$ref": "#/$defs/evidence"
        }
      }
    }
  }
}
