{
  "schema_version": 1,
  "last_updated": "2026-03-31",
  "maintainer_note": "Dynamic metrics should be updated from official APIs or clearly labeled estimates. Static architecture facts should be sourced from repository analysis or EVIDENCE.md.",
  "agents": [
    {
      "id": "claude-code",
      "name": "Claude Code",
      "category": "deep-analysis",
      "license": "专有",
      "developer": "Anthropic",
      "implementation_language": "Rust",
      "runtime": "Bun（内嵌）/ 原生二进制",
      "package_ecosystem": "npm",
      "stars": "85k",
      "downloads": {
        "type": "npm_weekly",
        "value": "1020万",
        "as_of": "2026-03-26"
      },
      "pricing_summary": "$20-200 / API 按量",
      "free_tier": "无",
      "evidence": {
        "status": "complete",
        "source_type": "binary-analysis",
        "evidence_path": "docs/tools/claude-code/EVIDENCE.md",
        "last_verified": "2026-03-26"
      }
    },
    {
      "id": "copilot-cli",
      "name": "Copilot CLI",
      "category": "deep-analysis",
      "license": "专有",
      "developer": "GitHub",
      "implementation_language": "TypeScript / Node.js SEA",
      "runtime": "原生二进制（回退需 Node.js >= 24）",
      "package_ecosystem": "npm",
      "stars": "10k",
      "downloads": {
        "type": "npm_weekly",
        "value": "64万",
        "as_of": "2026-03-26"
      },
      "pricing_summary": "$0-39 / Premium Requests",
      "free_tier": "有限",
      "evidence": {
        "status": "complete",
        "source_type": "binary-analysis",
        "evidence_path": "docs/tools/copilot-cli/EVIDENCE.md",
        "last_verified": "2026-03-26"
      }
    },
    {
      "id": "codex-cli",
      "name": "Codex CLI",
      "category": "deep-analysis",
      "license": "Apache-2.0",
      "developer": "OpenAI",
      "implementation_language": "Rust + Node.js wrapper",
      "runtime": "原生二进制（npm 启动器需 Node.js >= 16）",
      "package_ecosystem": "npm",
      "stars": "68k",
      "downloads": {
        "type": "npm_weekly",
        "value": "368万",
        "as_of": "2026-03-26"
      },
      "pricing_summary": "API 按量",
      "free_tier": "无",
      "evidence": {
        "status": "complete",
        "source_type": "binary-analysis",
        "evidence_path": "docs/tools/codex-cli/EVIDENCE.md",
        "last_verified": "2026-03-26"
      }
    },
    {
      "id": "gemini-cli",
      "name": "Gemini CLI",
      "category": "deep-analysis",
      "license": "Apache-2.0",
      "developer": "Google",
      "implementation_language": "TypeScript",
      "runtime": "Node.js >= 20",
      "package_ecosystem": "npm",
      "stars": "100k",
      "downloads": {
        "type": "npm_weekly",
        "value": "74万",
        "as_of": "2026-03-26"
      },
      "pricing_summary": "免费层 + API 按量",
      "free_tier": "1500 次/天",
      "evidence": {
        "status": "complete",
        "source_type": "source-analysis",
        "evidence_path": "docs/tools/gemini-cli/EVIDENCE.md",
        "last_verified": "2026-03-26"
      }
    },
    {
      "id": "qwen-code",
      "name": "Qwen Code",
      "category": "deep-analysis",
      "license": "Apache-2.0",
      "developer": "阿里云",
      "implementation_language": "TypeScript",
      "runtime": "Node.js >= 20",
      "package_ecosystem": "npm",
      "stars": "21k",
      "downloads": {
        "type": "npm_weekly",
        "value": "8.4万",
        "as_of": "2026-03-26"
      },
      "pricing_summary": "免费层 + DashScope 按量",
      "free_tier": "1000 次/天",
      "evidence": {
        "status": "complete",
        "source_type": "source-analysis",
        "evidence_path": "docs/tools/qwen-code/EVIDENCE.md",
        "last_verified": "2026-03-26"
      }
    },
    {
      "id": "aider",
      "name": "Aider",
      "category": "deep-analysis",
      "license": "GPL-3.0",
      "developer": "Paul Gauthier",
      "implementation_language": "Python",
      "runtime": "Python >= 3.10",
      "package_ecosystem": "pypi",
      "stars": "43k",
      "downloads": {
        "type": "pypi_monthly",
        "value": "78万",
        "as_of": "2026-03-26"
      },
      "pricing_summary": "API 按量",
      "free_tier": "无",
      "evidence": {
        "status": "complete",
        "source_type": "source-analysis",
        "evidence_path": "docs/tools/aider/EVIDENCE.md",
        "last_verified": "2026-03-26"
      }
    },
    {
      "id": "kimi-cli",
      "name": "Kimi CLI",
      "category": "deep-analysis",
      "license": "Apache-2.0",
      "developer": "月之暗面",
      "implementation_language": "Python",
      "runtime": "Python >= 3.12",
      "package_ecosystem": "pypi",
      "stars": "7k",
      "downloads": {
        "type": "pypi_monthly",
        "value": "45万",
        "as_of": "2026-03-26"
      },
      "pricing_summary": "API 按量",
      "free_tier": "有限免费额度",
      "evidence": {
        "status": "complete",
        "source_type": "source-analysis",
        "evidence_path": "docs/tools/kimi-cli/EVIDENCE.md",
        "last_verified": "2026-03-26"
      }
    },
    {
      "id": "opencode",
      "name": "OpenCode",
      "category": "deep-analysis",
      "license": "MIT",
      "developer": "Anomaly",
      "implementation_language": "TypeScript（v1.0+）",
      "runtime": "Bun 1.3+",
      "package_ecosystem": "none",
      "stars": "12k",
      "downloads": {
        "type": "none",
        "value": "—",
        "as_of": "2026-03-26"
      },
      "pricing_summary": "API 按量",
      "free_tier": "无",
      "evidence": {
        "status": "complete",
        "source_type": "source-analysis",
        "evidence_path": "docs/tools/opencode/EVIDENCE.md",
        "last_verified": "2026-03-26"
      }
    },
    {
      "id": "goose",
      "name": "Goose",
      "category": "deep-analysis",
      "license": "Apache-2.0",
      "developer": "Block / Linux Foundation",
      "implementation_language": "Rust",
      "runtime": "原生二进制 / Rust 构建",
      "package_ecosystem": "none",
      "stars": "34k",
      "downloads": {
        "type": "none",
        "value": "—",
        "as_of": "2026-03-26"
      },
      "pricing_summary": "API 按量",
      "free_tier": "无",
      "evidence": {
        "status": "complete",
        "source_type": "source-analysis",
        "evidence_path": "docs/tools/goose/EVIDENCE.md",
        "last_verified": "2026-03-26"
      }
    },
    {
      "id": "qoder-cli",
      "name": "Qoder CLI",
      "category": "deep-analysis",
      "license": "专有",
      "developer": "QoderAI",
      "implementation_language": "Go",
      "runtime": "原生静态链接二进制",
      "package_ecosystem": "npm-wrapper",
      "stars": "-",
      "downloads": {
        "type": "unknown",
        "value": "—",
        "as_of": "2026-03-26"
      },
      "pricing_summary": "信用制",
      "free_tier": "300 credits",
      "evidence": {
        "status": "partial",
        "source_type": "binary-analysis",
        "evidence_path": "docs/tools/qoder-cli/EVIDENCE.md",
        "last_verified": "2026-03-26"
      }
    },
    {
      "id": "oh-my-openagent",
      "name": "Oh My OpenAgent",
      "category": "single-file",
      "license": "SUL-1.0",
      "developer": "code-yeongyu",
      "implementation_language": "TypeScript",
      "runtime": "OpenCode Harness / Node.js",
      "package_ecosystem": "npm",
      "stars": "~45k",
      "downloads": {
        "type": "unknown",
        "value": "—",
        "as_of": "2026-03-26"
      },
      "pricing_summary": "取决于底层模型提供商",
      "free_tier": "取决于底层提供商",
      "evidence": {
        "status": "single-file-only",
        "source_type": "summary-analysis",
        "evidence_path": "docs/tools/oh-my-openagent.md",
        "last_verified": "2026-03-26"
      }
    },
    {
      "id": "cline",
      "name": "Cline",
      "category": "single-file",
      "license": "Apache-2.0",
      "developer": "Cline",
      "implementation_language": "TypeScript",
      "runtime": "VS Code 扩展",
      "package_ecosystem": "vscode-marketplace",
      "stars": "60k",
      "downloads": {
        "type": "unknown",
        "value": "—",
        "as_of": "2026-03-26"
      },
      "pricing_summary": "取决于模型提供商",
      "free_tier": "取决于模型提供商",
      "evidence": {
        "status": "single-file-only",
        "source_type": "summary-analysis",
        "evidence_path": "docs/tools/cline.md",
        "last_verified": "2026-03-26"
      }
    },
    {
      "id": "continue",
      "name": "Continue",
      "category": "single-file",
      "license": "Apache-2.0",
      "developer": "Continue",
      "implementation_language": "TypeScript",
      "runtime": "IDE 扩展",
      "package_ecosystem": "vscode-marketplace",
      "stars": "32k",
      "downloads": {
        "type": "unknown",
        "value": "—",
        "as_of": "2026-03-26"
      },
      "pricing_summary": "取决于模型提供商",
      "free_tier": "取决于部署方式",
      "evidence": {
        "status": "single-file-only",
        "source_type": "summary-analysis",
        "evidence_path": "docs/tools/continue.md",
        "last_verified": "2026-03-26"
      }
    },
    {
      "id": "cursor-cli",
      "name": "Cursor CLI",
      "category": "single-file",
      "license": "专有",
      "developer": "Cursor",
      "implementation_language": "TypeScript",
      "runtime": "IDE / Desktop",
      "package_ecosystem": "desktop",
      "stars": "~33k",
      "downloads": {
        "type": "unknown",
        "value": "—",
        "as_of": "2026-03-26"
      },
      "pricing_summary": "订阅制",
      "free_tier": "有限",
      "evidence": {
        "status": "single-file-only",
        "source_type": "summary-analysis",
        "evidence_path": "docs/tools/cursor-cli.md",
        "last_verified": "2026-03-26"
      }
    },
    {
      "id": "openhands",
      "name": "OpenHands",
      "category": "single-file",
      "license": "MIT",
      "developer": "OpenHands",
      "implementation_language": "Python",
      "runtime": "Python / Docker",